"http://www.sciencedirect.com/science/article/pii/S1742287619301628"; "Digital Investigation"; "2019"; "Various Internet of Things (IoT) devices, such as AI speakers, are being released with different functions to improve user convenience and better life. An AI speaker ecosystem is a cloud-based IoT system built around an AI speaker and IoT devices. In the near future, citizens in whole countries worldwide will be helped in real life when AI-equipped devices are deployed in their homes. Typically, because AI speakers are always operating, they can be used to provide vital evidence for digital forensics; however, privacy issues may arise. AI speakers have provided evidence of murders in the United States and Mexico and are being released without specific regulatory guidelines. In this study, we propose five digital forensic analysis methods for four AI speaker models from different manufacturers released in the Republic of Korea. The five proposed methods are applied to all the AI speaker models, and the results are presented in the Appendix. In particular, we developed a forensic tool for collecting user command history for NAVER Clova."; "Digital Forensic Practices and Methodologies for AI Speaker Ecosystems"; 
"http://www.sciencedirect.com/science/article/pii/S0167404818310629"; "Computers & Security"; "2019"; "Cloud computing has grown for various IT capabilities such as IoTs, Mobile Computing, Smart IT, etc. However, due to the dynamic and distributed nature of cloud and vulnerabilities existing in the current implementations of virtualization, several security threats and attacks have been reported. To address these issues, there is a need of extending traditional security solutions like firewall, intrusion detection/prevention systems which can cope up with high-speed network traffic and dynamic network configuration in the cloud. In addition, identifying feasible network traffic features is a major challenge for an accurate detection of the attacks. In this paper, we propose a hypervisor level distributed network security (HLDNS) framework which is deployed on each processing server of cloud computing. At each server, it monitors the underlying virtual machines (VMs) related network traffic to/from the virtual network, internal network and external network for intrusion detection. We have extended a binary bat algorithm (BBA) with two new fitness functions for deriving the feasible features from cloud network traffic. The derived features are applied to the Random Forest classifier for detecting the intrusions in cloud network traffic and intrusion alerts are generated. The intrusion alerts from different servers are correlated to identify the distributed attack and to generate new attack signature. For the performance and feasibility analysis, the proposed security framework is tested on the cloud network testbed at NIT Goa and using recent UNSW-NB15 and CICIDS-2017 intrusion datasets. We have performed a comparative analysis of the proposed security framework in terms of fulfilling the cloud network security needs."; "Designing an efficient security framework for detecting intrusions in virtual network of cloud computing"; 
"http://www.sciencedirect.com/science/article/pii/S138912861830817X"; "Computer Networks"; "2019"; "To support various new use cases from vertical industries besides enhanced mobile broadband communication services, the 5G system aims to provide higher speed, lower latency, and massive connectivity to various devices by leveraging the evolution of 4G with the addition of new radio technology, service-based architecture, and cloud infrastructure. The introduction of new technologies, new use cases and people’s growing concerns regarding privacy issues brings new challenges to providing security and privacy protection for 5G. This paper makes an extensive review of the state of the art towards ensuring 5G security and privacy. By analyzing the lessons from the 4G security system, the requirements from new scenarios and models, the challenges resulting from new technology and paradigm, we identify typical security and privacy issues to be solved in 5G. Then, we discuss potential solutions from academia and industry to secure 5G networks from several perspectives, including the overall 5G security framework, core network, radio access network, cloud infrastructure, and the Internet of things. Finally, several key open issues and potential research directions are identified and discussed."; "Towards secure 5G networks: A Survey"; 
"http://www.sciencedirect.com/science/article/pii/S1084804517303521"; "Journal of Network and Computer Applications"; "2018"; "This paper presents a comprehensive survey of existing authentication and privacy-preserving schemes for 4G and 5G cellular networks. We start by providing an overview of existing surveys that deal with 4G and 5G cellular networks. Then, we give a classification of threat models in 4G and 5G cellular networks in four categories, including, attacks against privacy, attacks against integrity, attacks against availability, and attacks against authentication. We also provide a classification of countermeasures into three types of categories, including, cryptography methods, humans factors, and intrusion detection methods. The countermeasures and informal and formal security analysis techniques used by the authentication and privacy preserving schemes are summarized in form of tables. Based on the categorization of the authentication and privacy models, we classify these schemes in seven types, including, handover authentication with privacy, mutual authentication with privacy, RFID authentication with privacy, deniable authentication with privacy, authentication with mutual anonymity, authentication and key agreement with privacy, and three-factor authentication with privacy. In addition, we provide a taxonomy and comparison of authentication and privacy-preserving schemes for 4G and 5G cellular networks in form of tables. Based on the current survey, several recommendations for further research are discussed at the end of this paper."; "Security for 4G and 5G cellular networks: A survey of existing authentication and privacy-preserving schemes"; 
"http://www.sciencedirect.com/science/article/pii/S1389128617301925"; "Computer Networks"; "2017"; "Middleboxes are widely deployed devices that play crucial roles in today’s networks. Their behavior is commonly determined by policies that are manually set by network administrators, what may be a burden for networks whose connectivity dynamically changes. Recently, with the advent of Software-Defined Networking (SDN), a number of possibilities for handling middlebox policy enforcement have emerged. Even though there have been some contributions in this area, none of them eliminate the necessity of manual configuration of middleboxes for policy enforcement. In this paper, we propose an SDN-based architecture for dynamic middlebox policy enforcement that is able to respond to network events without any manual intervention from the network administrator. The architecture is also based on an interface proposed in this paper that enables the communication between an SDN controller and any middlebox. To evaluate the policy enforcement architecture, a prototype with two types of middleboxes, a firewall and an Intrusion Prevention System (IPS), was implemented in a virtual machine. Hypothesis tests were performed in order to validate the experimental results obtained with the prototype. Results show that the architecture is able to dynamically enforce middlebox policies, allowing network applications to run appropriately with no impact on network performance."; "An efficient architecture for dynamic middlebox policy enforcement in SDN networks"; 
"http://www.sciencedirect.com/science/article/pii/S1084804519301924"; "Journal of Network and Computer Applications"; "2019"; "As one of the many advantages of cloud computing, Network Function Virtualization (NFV) has revolutionized the network and telecommunication industry through enabling the migration of network functions from expensive dedicated hardware to software-defined components that run in the form of Virtual Network Functions (VNFs). However, with NFV comes numerous challenges related mainly to the complexity of deploying and adjusting VNFs in the physical networks, owing to the huge number of nodes and links in today's datacenters, and the inter-dependency among VNFs forming a certain network service. Several contributions have been made in an attempt to answer these challenges, where most of the existing solutions focus on the static placement of VNFs and overlook the dynamic aspect of the problem, which arises mainly due to the ever-changing resource availability in the cloud datacenters and the continuous mobility of the users. Few attempts have been lately made to incorporate the dynamic aspect to the VNF deployment solutions. The main problem of these approaches lies in their reactive readjustment scheme which determines the placement/migration strategy upon the receipt of a new request or the happening of a certain event, thus resulting in high setup latencies. In this paper, we take advantage of machine learning to reduce the complexity of the placement and readjustment processes through designing a cluster-based proactive solution. The solution consists of (1) an Integer Linear Programming (ILP) model that considers a tradeoff between the minimization of the latency, Service-Level Objective (SLO) violation cost, hardware utilization, and VNF readjustment cost, (2) an optimized k-medoids clustering approach which proactively partitions the substrate network into a set of disjoint on-demand clusters and (3) data-driven cluster-based placement and readjustment algorithms that capitalize on machine learning to intelligently eliminate some cost functions from the optimization problem to boost its feasibility in large-scale networks. Simulation results show that the proposed solution considerably reduces the readjustment time and decrease the hardware utilization compared to the K-means, original k-medoids and migration without clustering approaches."; "MAPLE: A Machine Learning Approach for Efficient Placement and Adjustment of Virtual Network Functions"; 
"http://www.sciencedirect.com/science/article/pii/S1877050916316957"; "Procedia Computer Science"; "2016"; "Today we witness the appearance of two additional to Big Data concepts: data lakes and fast data. Are they simply the new marketing labels for the old Big Data IT or really new ones? Thus the key goal of the paper is to identify the relationship between these three concepts."; "Big Data, Fast Data and Data Lake Concepts"; 
"http://www.sciencedirect.com/science/article/pii/S108480451930195X"; "Journal of Network and Computer Applications"; "2019"; "Evolution of smart cities induces critical challenges related to cyber and network security. The increased reliance of a smart city on Information and Communication Technologies (ICT) infrastructure improves automation, efficiency, and sustainability of city services. However, it also poses enormous challenges for ensuring continued operations and services at all times and especially under cyber-attacks. Any lapse in cyber security can lead to critical disaster across the city. Distributed Denial of Service (DDoS) attacks are considered to be the most predominant and prevalent cyber-attacks. We believe that smart city could consist of numerous applications with varying level of network and security requirements. Therefore, providing an adaptive mechanism against DDoS attacks for all applications in a smart city is a key challenge. Further, considering the wide-scale requirements of a smart city, developing an adaptive and flexible solution is a key requirement. Considering these requirements, this paper presents SEAL (SEcure and AgiLe) – a novel Software Defined Networking (SDN) based adaptive framework for protecting smart city applications against DDoS attacks. The SEAL framework leverages key characteristics of SDN such as the global visibility, centralized control, and programmability to enhance the security and resilience. SEAL is capable of effectively detecting and mitigating DDoS attacks not only on application servers but also on network resources. SEAL is also unique in this regard that it provides application specific DDoS attack security solution instead of static threshold mechanism. Moreover, inherently distributed architecture of the SEAL framework ensures fault tolerance, scalability and reliability of the smart city. The SEAL framework comprises three modules, namely D-Defense, A-Defense and C-Defense. These modules collectively provide a mechanism to detect and mitigate DDoS attack on smart city applications and the network infrastructure. Adaptability in SEAL is achieved through implementing customized version of estimated-weighted moving average (EWMA) filters. Three types of filters, Proactive Filter, Active Filter, and Passive Filter are proposed and implemented to compute the dynamic threshold in real time for various types of applications. Experimental evaluation of the SEAL framework has been conducted to establish the efficacy of the framework and its components in detecting and mitigating DDoS attacks. The results prove that SEAL is able to detect and mitigate DDoS attacks effectively. The focus of the SEAL framework is to protect smart city applications, however, the SEAL framework can potentially be utilized in a wide range of systems."; "SEAL: SDN based secure and agile framework for protecting smart city applications from DDoS attacks"; 
"http://www.sciencedirect.com/science/article/pii/S1084804517303569"; "Journal of Network and Computer Applications"; "2018"; "Context; "Data exfiltration: A review of external attack vectors and countermeasures"; 
"http://www.sciencedirect.com/science/article/pii/S0167404817300901"; "Computers & Security"; "2017"; "Supervisory Control and Data Acquisition (SCADA) systems are widely used in many applications including power transmission and distribution for situational awareness and control. Identifying and detecting intrusions in a SCADA is a critical and demanding task in recent days. For this purpose, various Intrusion Detection Systems (IDSs) are developed in the existing works. But, it has some drawbacks including it has high false positive and false negative rates, it cannot detect the encrypted date and it supports only for detecting the external intrusions. In order to overcome all these issues, an Intrusion Weighted Particle based Cuckoo Search Optimization (IWP-CSO) and Hierarchical Neuron Architecture based Neural Network (HNA-NN) techniques are proposed in this paper. The main intention of this paper is to detect and classify the intrusions in a SCADA network based on the optimization. At first, the input network dataset is given as the input, where the attributes are arranged and the clusters are initialized. Then, the features are optimized to select the best attributes by using the proposed IWP-CSO algorithm. Finally, the intrusions in a network are classified by employing the proposed HNA-AA algorithm. The experimental results evaluate the performance of the proposed system in terms of sensitivity, specificity, precision, recall, accuracy, Jaccard, Dice and false detection rate."; "An enhanced optimization based algorithm for intrusion detection in SCADA network"; 
"http://www.sciencedirect.com/science/article/pii/S1389128618300306"; "Computer Networks"; "2018"; "Today’s networks are filled with a massive and ever-growing variety of network functions that coupled with proprietary devices, which leads to network ossification and difficulty in network management and service provision. Network Function Virtualization (NFV) is a promising paradigm to change such situation by decoupling network functions from the underlying dedicated hardware and realizing them in the form of software, which are referred to as Virtual Network Functions (VNFs). Such decoupling introduces many benefits which include reduction of Capital Expenditure (CAPEX) and Operation Expense (OPEX), improved flexibility of service provision, etc. In this paper, we intend to present a comprehensive survey on NFV, which starts from the introduction of NFV motivations. Then, we explain the main concepts of NFV in terms of terminology, standardization and history, and how NFV differs from traditional middle-box based network. After that, the standard NFV architecture is introduced using a bottom up approach, based on which the corresponding use cases and solutions are also illustrated. In addition, due to the decoupling of network functionalities and hardware, people’s attention is gradually shifted to the VNFs. Next, we provide an extensive and in-depth discussion on state-of-the-art VNF algorithms including VNF placement, scheduling, migration, chaining and multicast. Finally, to accelerate the NFV deployment and avoid pitfalls as far as possible, we survey the challenges faced by NFV and the trend for future directions. In particular, the challenges are discussed from bottom up, which include hardware design, VNF deployment, VNF life cycle control, service chaining, performance evaluation, policy enforcement, energy efficiency, reliability and security, and the future directions are discussed around the current trend towards network softwarization."; "A comprehensive survey of Network Function Virtualization"; 
"http://www.sciencedirect.com/science/article/pii/S2215098618312977"; "Engineering Science and Technology, an International Journal"; "2019"; "It has been widely assumed by the research community that the network reconnaissance attacks in IPv6 networks are unfeasible because they would take tremendous effort to perform address scanning of 264 hosts in an IPv6 subnet. However, recent research has revealed feasibility of these attacks by investigating a number of native IPv6 networks. The research concluded that an intelligent attacker could easily reduce the target search space by predicting the network host addressing schemes when performing the scanning. This indeed enhances security concerns and undermines the chances of IPv6 being deployed. This paper outlines the IPv6 addressing strategies currently used and proposes a new strategy to mitigate reconnaissance attacks. The new strategy is evaluated against some reconnaissance attack approaches and compared with some recent IPv6 addressing strategies. The experimental results confirm the effectiveness and validation of the addressing strategy in terms of the mitigation of reconnaissance attacks."; "SEUI-64, bits an IPv6 addressing strategy to mitigate reconnaissance attacks"; 
"http://www.sciencedirect.com/science/article/pii/S0167739X17310488"; "Future Generation Computer Systems"; "2018"; "Since the nodes are battery operated and replenishment of battery is almost impossible especially when the nodes deployed at far distant and unattended areas. The extensive devices connected through Internet of Things (IoT) bring forth many challenges such as high battery power consumption, designing of smart e-health devices, construction of smart home control system, etc. However, among these challenges, network lifetime in the case of IoT embedded devices communications, battery lifetime of IoT devices, and deployment of sensor networks are the most prominent challenges exist in the current literature. Therefore, to extend the network lifetime and minimum utilization of battery, all the steps from node deployment to network architecture (in our case, we are considering clustered network architecture) and from sensing the environment to sharing the sensed data to the BS (i.e. routing) should be designed in a careful way. Decreasing the broadcasting of packets, and lessening the computation at the node level and minimizing the packet overhead play their important role in the conservation of energy that pushes toward better network throughput. In our under-discussed research work, we are in an aim to increase the network throughput by conserving the energy, especially during the routing process. Our work targets the constituent phases of cluster based aware energy routing for maximizing the throughput by decreasing the end-to-end delay, less packet drop ratio and improving network lifetime. Our strategies of customized, proactive routing, localized behavior strategies and in-network processing help in achieving our goal."; "Energy and interoperable aware routing for throughput optimization in clustered IoT-wireless sensor networks"; 
"http://www.sciencedirect.com/science/article/pii/S1877050917319853"; "Procedia Computer Science"; "2017"; "Wireless security is concise on protecting the resources connected to the wireless network from unauthorized access. Wi-Fi Protected Access II (WPA2) is a predominant variety of cryptography based wireless security protocol, which is crafted to be robust and can prevent all the wireless attacks. But numerous organizations explicitly like educational institutions remains vulnerable due to lack of security. By auditing the vulnerabilities and performing the penetration testing, it is possible to review the causes of the issues indicted over the network. Wireless security auditing is anticipated to be an exact blend of attack scenario and the well matched audit policy checklist provides a benchmark for a sheltered wireless network in safe hands."; "Wireless Security Auditing: Attack Vectors and Mitigation Strategies"; 
"http://www.sciencedirect.com/science/article/pii/S2210537919300575"; "Sustainable Computing: Informatics and Systems"; "2019"; "Privacy and trustworthiness are the key apprehensions for the users of Internet of Vehicle (IoV) services. Having multiple components involved in the communication (i.e., sensors, vehicles, humans, and infrastructures), the IoV platforms are exposed to a range of attacks. This manuscript will focus on Distributed Denial of Service (DDOS) attacks by adding the design of an Intrusion Detection Systems (IDS) tailored to IoV systems. Moreover, Artificial Intelligence (AI) and Machine Learning (ML) techniques will be investigated that can help in making refined defense architecture for countering DDOS attacks in IoV networks. Furthermore, a fuzzy logic and Q-learning based proposed solution is tested through simulations which argues about the usefulness of the proposed approach in comparison with conventional techniques."; "DDoS attack detection: A key enabler for sustainable communication in internet of vehicles"; 
"http://www.sciencedirect.com/science/article/pii/S1570870518307844"; "Ad Hoc Networks"; "2019"; "Advanced Metering Infrastructure (AMI), which refers to the communication network for the collection of power data from smart meters in a Smart Grid, is expected to be used in the service of many Smart City applications such as gas and water data collection or electric vehicle charging. As the communication within the AMI needs to be secure to protect user’s power data, key management becomes a challenge due to its overhead and limited resources on smart meters. While using public-keys eliminate some of the overhead of key management as opposed to symmetric-key management, there are still challenges regarding the management of certificates that store and certify the public-keys. In particular, distribution and storage of certificate revocation list (CRL) is major a challenge due to cost of distribution and storage in AMI networks which is envisioned to utilize wireless mesh networks. Motivated by the need of keeping the CRL distribution and storage cost effective and scalable, in this paper, we present a distributed CRL management scheme by utilizing distributed hash trees (DHTs) that have been heavily employed in peer-to-peer (P2P) networks. The basic idea is to share the burden of storage of CRLs among all the smart meters by exploiting the convenient wireless communication capability of the smart meters among each other. Using DHTs not only reduces the space requirements for CRLs but also makes the CRL updates more convenient. We implemented DHT-based CRL structure both on ns-3 and testbed using IEEE 802.11s mesh standard as a model for AMI and demonstrated its superior performance with respect to traditional methods of CRL management through extensive simulations."; "Efficient certificate revocation management schemes for IoT-based advanced metering infrastructures in smart cities"; 
"http://www.sciencedirect.com/science/article/pii/S136137231930020X"; "Computer Fraud & Security"; "2019"; "Cloud computing has become one of the most critical components of businesses and corporate organisations worldwide. It is a technology that has applications and services running on distributed networks and pooled virtualised resources that small, medium and large organisations can utilise to host their applications, processes and portals online via datacentres to provide access over the Internet to end users, customers and employees. In today's dynamic business world, traditional IT systems cannot keep up with ever-changing market demands and complex environments. Cloud computing has become one of the most critical components of enterprises worldwide. In today's dynamic business world, traditional IT systems cannot keep up with ever-changing market demands and complex environments. Many organisations are seeking an all-purpose cloud deployment to achieve increased service quality, which translates into better security and higher performance. In such cases, it becomes critical to concentrate on metrics for security and performance. Akashdeep Bhardwaj and Sam Goundar propose a framework for examining those two crucial elements."; "A framework to define the relationship between cyber security and cloud performance"; 
