"http://www.sciencedirect.com/science/article/pii/S1353485817300259"; "Network Security"; "2017"; "Big data refers to huge data sets that have come about through the phenomenal growth being seen in the volume of information collected, produced, analysed, shared and stored by organisations. By analysing big data sets, valuable insights can be gained into how patterns of data are associated to enable better-informed decision-making, which can aid in competitiveness and drive innovation. According to Gartner, 48% of organisations had invested in big data capabilities in 2016. Big data programmes benefit organisations in many ways, driving competitiveness and innovation. But they can also increase security risks owing to the vast amount of sensitive information they hold. Big data sets harness information from multiple sources such as databases, data warehouses, log and event files, security controls such as intrusion prevention systems and usergenerated data from sources such as emails and social media posts. So data security is a must for any organisation, and encryption needs to be a key part of that, says Colin Tankard of Digital Pathways."; "Encryption as the cornerstone of big data security"; 
"http://www.sciencedirect.com/science/article/pii/S0167739X18302930"; "Future Generation Computer Systems"; "2019"; "Software Defined Networking (SDN) separates the control logic from data forwarding and shifts the whole decision power to the controller, making the switch a dumb device. SDNs are becoming more and more important due to the key features like scalability, flexibility and monitoring. The centralized control of SDN makes it vulnerable to different attacks such as Flooding, Spoofing, Denial of Service (DoS), etc. These attacks can degrade the SDN performance by overwhelming its different components such as controller, switch and control channel. This paper provides a comprehensive review of different mitigation approaches and categorizes them into three different classes on the basis of their methodology to handle the malicious traffic. In addition to that, we find out limitations in these mitigation approaches and propose the possible features of an optimal solution against DoS attacks. To the best of our knowledge, this work is the first attempt toward classifying DoS mitigation strategies and finding out their limitations in the SDN environment."; "Toward an optimal solution against Denial of Service attacks in Software Defined Networks"; 
"http://www.sciencedirect.com/science/article/pii/S0305054816301113"; "Computers & Operations Research"; "2016"; "Today's organizations are inherently open and connected, sharing knowledge and ideas in order to remain innovative. As a result, these organizations are also more vulnerable to information theft through different forms of security breaches caused by hackers and competitors. One way of understanding the vulnerability of an information system is to build and analyze the attack graph of that system. The attack graph of an information system contains all the paths that can be used to penetrate the system in order to breach critical assets. Although existing literature provides an abundance of attack graph generation algorithms, more methods are required to help analyze the attack graphs. In this paper, we study how best to deploy security countermeasures to protect an organization by analyzing the vulnerability of the organization through the use of its attack graph. In particular, we present an approach to find an optimal affordable subset of arcs, called an interdiction plan, on an attack graph that should be protected from attack to minimize the loss due to security breaches. We formulate this problem as a bi-level mixed-integer linear program and develop an exact algorithm to solve it. Experiments show that the algorithm is able to solve relatively large problems. Two heuristic methods, one with and the other without a heuristic to solve the master problem and both limiting the master problem branch-and-bound tree to only one node solve the large problems remarkably well. Experiments also reveal that the quality of an interdiction plan is relatively insensitive with respect to the error in the estimate of the attacker's budget, and that the breach loss drops sharply at the beginning, then levels off before finally dropping sharply again with increases in the security budget."; "Interdicting attack graphs to protect organizations from cyber attacks: A bi-level defender–attacker model"; 
"http://www.sciencedirect.com/science/article/pii/S0167739X17308567"; "Future Generation Computer Systems"; "2018"; "In the Internet of Things (IoT) era, a variety of devices that accumulate a range of data and electronic information are connected to the internet. This information is intelligently processed to create new services. As a result, the range of security risks is expanded, and the risk of compromise of electronic information is increasing. To combat this risk, research and investments in electronic information security technology is steadily increasing, and various security systems are being steadily developed. However, since electronic information security technology suitable for the IoT environment is not classified, many security systems perform redundant functions. The use of redundant security systems not only wastes costs in terms of security management, but also inefficiently performs security operations."; "An analysis of security systems for electronic information for establishing secure internet of things environments: Focusing on research trends in the security field in South Korea"; 
"http://www.sciencedirect.com/science/article/pii/S1386505619305179"; "International Journal of Medical Informatics"; "2019"; "Background; "Legal Framework for Health Cloud: A Systematic Review"; 
"http://www.sciencedirect.com/science/article/pii/S016740481730038X"; "Computers & Security"; "2017"; "The advantage of having remote access motivates network administrators to connect mission-critical servers (e.g., enterprise management systems) as well as public web servers via the Internet, even though connecting these mission-critical servers to the Internet is not recommended. These mission-critical or public servers are accessible from any host on the Internet, allowing cyber attackers to engage the targeted server as part of a process to discover potential exploits and unpatched vulnerabilities. Although it would be difficult to eradicate all the potential vulnerabilities in advance, accessibility to a server can be controlled to limit or minimize the chance of exposing a vulnerable surface. We aimed to address the accessibility issue by designing and prototyping an Invi-server system, in which the IP and MAC addresses of the protected secret server remain invisible from external scanning and eavesdropping trials and even from compromised internal hosts on the network. This Invi-server system can be used as a way to reduce the attack surface of a protected server while allowing authorized users to send and receive packets via the protected server. We also implemented a prototype of the Invi-server system to demonstrate that our proposed system has the ability to reduce the attack surfaces significantly without increasing network performance overhead to any significant extent."; "Invi-server: Reducing the attack surfaces by making protected server invisible on networks"; 
"http://www.sciencedirect.com/science/article/pii/S0167404818311349"; "Computers & Security"; "2019"; "Distributed denial of service (DDoS) cyber-attack poses a severe threat to the industrial Internet of Things (IIoT) operation due to the security vulnerabilities resulted from increased connectivity and openness, and the large number of deployed low computation power devices. This paper applies Fog computing concept in DDoS mitigation by allocating traffic monitoring and analysis work close to local devices, and, on the other hand, coordinating and consolidating work to cloud central servers so as to achieve fast response while at low false alarm rate. The mitigation scheme consists of real-time traffic filtering via field firewall devices, which are able to reversely filter the signature botnet attack packets; offline specification based traffic analysis via virtualized network functions (VNFs) in the local servers; and centralized coordination via cloud server, which consolidates and correlates the information from the distributed local servers to make a more accurate decision. The proposed scheme is tested in an industrial control system testbed and the experiments evaluate the detection time and rate for two types of DDoS attacks and demonstrate the effectiveness of the scheme."; "A fog computing based approach to DDoS mitigation in IIoT systems"; 
"http://www.sciencedirect.com/science/article/pii/S0045790617333876"; "Computers & Electrical Engineering"; "2018"; "We propose a scheme for Cloud-of-Things and Edge Computing (CoTEC) traffic management in multi-domain networks. To direct the traffic flow through the service nodes, we assign a critical egress point for each traffic flow in the CoTEC network using multiple egress routers to optimize the traffic flow; this is known as Egress-Topology (ET). Therefore, the proposed ET incorporates traditional multi-topology routing in the CoTEC network to address the inconsistencies between service overlay routing and the border gateway protocol policies. Furthermore, the proposed ET introduces a number of programmable nodes that can be configured to ease the ongoing traffic on the network and re-align services among the other nodes in multi-domain networks. The results show that our algorithm has a lower execution time and better quality of service than that obtained without using our algorithm, thus allowing us to satisfy the flexibility and efficiency demands of multi-domain networks."; "Efficient algorithm for traffic engineering in Cloud-of-Things and edge computing"; 
"http://www.sciencedirect.com/science/article/pii/S1084804512001178"; "Journal of Network and Computer Applications"; "2013"; "In this paper, we survey different intrusions affecting availability, confidentiality and integrity of Cloud resources and services. Proposals incorporating Intrusion Detection Systems (IDS) and Intrusion Prevention Systems (IPS) in Cloud are examined. We recommend IDS/IPS positioning in Cloud environment to achieve desired security in the next generation networks."; "A survey of intrusion detection techniques in Cloud"; 
"http://www.sciencedirect.com/science/article/pii/S1084804518300419"; "Journal of Network and Computer Applications"; "2018"; "The evolving trends of mobility, cloud computing and collaboration have blurred the perimeter separating corporate networks from the wider world. These new tools and business models enhance productivity and present new opportunities for competitive advantage although they also introduce new risks. Currently, security is one of the most limiting issues for technological development in fields such as Internet of Things or Cyber-physical systems. This work contributes to the cyber security research field with a design that can incorporate advanced scheduling algorithms and predictive models in a parallel and distributed way, in order to improve intrusion detection in the current scenario, where increased demand for global and wireless interconnection has weakened approaches based on protection tasks running only on specific perimeter security devices. The aim of this paper is to provide a framework to properly distribute intrusion detection system (IDS) tasks, considering security requirements and variable availability of computing resources. To accomplish this, we propose a novel approach, which promotes the integration of personal and enterprise computing resources with externally supplied cloud services, in order to handle the security requirements. For example, in a business environment, there is a set information resources that need to be specially protected, including data handled and transmitted by small mobile devices. These devices can execute part of the IDS tasks necessary for self-protection, but other tasks could be derived to other more powerful systems. This integration must be achieved in a dynamic way: cloud resources are used only when necessary, minimizing utility computing costs and security problems posed by cloud, but preserving local resources when those are required for business processes or user experience. In addition to satisfying the main objective, the strengths and benefits of the proposed framework can be explored in future research. This framework provides the integration of different security approaches, including well-known and recent advances in intrusion detection as well as supporting techniques that increase the resilience of the system. The proposed framework consists of: (1) a controller component, which among other functions, decides the source and target hosts for each data flow; and (2) a switching mechanism, allowing tasks to redirect data flows as established by the controller scheduler. The proposed approach has been validated through a number of experiments. First, an experimental DIDS is designed by selecting and combining a number of existing IDS solutions. Then, a prototype implementation of the proposed framework, working as a proof of concept, is built. Finally, singular tests showing the feasibility of our approach and providing a good insight into future work are performed."; "Scheduling framework for distributed intrusion detection systems over heterogeneous network architectures"; 
"http://www.sciencedirect.com/science/article/pii/S0167739X15003118"; "Future Generation Computer Systems"; "2016"; "This article presents a cloud computing adoption framework (CCAF) security suitable for business clouds. CCAF multilayered security is based on the development and integration of three major security technologies: firewall, identity management, and encryption based on the development of enterprise file sync and share technologies. This article presents the vision, related works, and views on security framework. Core technologies have been explained in detail, and experiments were designed to demonstrate the robustness of the CCAF multilayered security. In penetration testing, CCAF multilayered security could detect and block 99.95% viruses and trojans, and could achieve ≥85% of blocking for 100 h of continuous attack. Detection and blocking took <0.012s/trojan or virus. A full CCAF multilayered security protection could block all SQL (structured query language) injection, providing real protection to data. CCAF multilayered security did not report any false alarm. All F-measures for CCAF test results were ≥99.75%. The mechanism of blending of CCAF multilayered security with policy, real services, and business activities has been illustrated. Research contributions have been justified and CCAF multilayered security can be beneficial for volume, velocity, and veracity of big data services operated in the cloud."; "Cloud computing adoption framework: A security framework for business clouds"; 
"http://www.sciencedirect.com/science/article/pii/S1389128618301208"; "Computer Networks"; "2018"; "Internet of Things (IoT) is one of the promising technologies that has attracted a lot of attention in both industrial and academic fields these years. It aims to integrate seamlessly both physical and digital worlds in one single ecosystem that makes up a new intelligent era of Internet. This technology offers a huge business value for organizations and provides opportunities for many existing applications such as energy, healthcare and other sectors. However, as new emergent technology, IoT suffers from several security issues which are most challenging than those from other fields regarding its complex environment and resources-constrained IoT devices. A lot of researches have been initiated in order to provide efficient security solutions in IoT, particularly to address resources constraints and scalability issues. Furthermore, some technologies related to networking and cryptocurrency fields such as Software Defined Networking (SDN) and Blockchain are revolutionizing the world of the Internet of Things thanks to their efficiency and scalability. In this paper, we provide a comprehensive top down survey of the most recent proposed security and privacy solutions in IoT. We discuss particularly the benefits that new approaches such as blockchain and Software Defined Networking can bring to the security and the privacy in IoT in terms of flexibility and scalability. Finally, we give a general classification of existing solutions and comparison based on important parameters."; "Internet of things security: A top-down survey"; 
"http://www.sciencedirect.com/science/article/pii/S0166361518303658"; "Computers in Industry"; "2018"; "The cybersecurity issues represent a complex challenge for all companies committing to Industry 4.0 paradigm. On the other hand, the characterization of cybersecurity concept within Industry 4.0 contexts proved to be an emerging and relevant topic in the recent literature. The paper proposes to analyse, through a systematic literature review approach, the way in which the existing state of art deals with the cybersecurity issues in Industry 4.0 contexts. In particular, the focus will be on the investigation of the main elements associated with cybersecurity theme (i.e. asset involved into cyber-attacks, system vulnerabilities, cyber threats, risks and countermeasures) within those industrial contexts where physical systems (machines, shop floors, plants) are connected each other via the Internet. Four areas of analysis are defined: definitions of cybersecurity and Industry 4.0 concepts, the industrial focus of the analysed studies, the cybersecurity characterization and the management attempts of cybersecurity issues. Through the literature review analysis, a framework of the main features characterizing each area is discussed, providing interesting evidences for future research and applications."; "Cybersecurity for Industry 4.0 in the current literature: A reference framework"; 
"http://www.sciencedirect.com/science/article/pii/S1353485815300489"; "Network Security"; "2015"; "It has never been more important for businesses to strengthen their IT security. Amid a growing, more sophisticated range of threats and increasing EU legislation that will dispense large fines to those failing to smarten up and protect their data, time is now of the essence. Amid a growing, more sophisticated range of threats and increasing EU legislation that will dispense large fines to those failing to smarten up and protect their data, organisations need to get their act together. It's important that all businesses prepare themselves for the new regulations – and do it now. In the process, they may find they accrue a number of business benefits. The technologies and processes they need to put in place will make them more resilient to today's threats and could even be used as a market differentiator, argues Stuart Hooson of Pinnacle Technology Group."; "Smarten your data security before new EU legislation or risk corporate loss"; 
"http://www.sciencedirect.com/science/article/pii/S0306261917309467"; "Applied Energy"; "2018"; "Along with the technical feasibility of microgrids, the importance of supervisory communications, computing, and control (CCC) systems that are necessary to operate a microgrid in a stable and economically feasible manner have been firmly established in the literature. While several investigators have proposed and demonstrated algorithms and applications of CCC, the functional entities and responsibility centers for realizing CCC within microgrids in the context of multiple independent customers and distribution system entities have not been situated and/or studied. In this context, the term emergent microgrid may be used to define an electrical network that consists of local generation, loads, and storage. Such a grid has the potential to be clustered as a microgrid, but does not have all the CCC features to become a full-fledged microgrid. In this paper, a simple electric utility platform (SEUP) that is an end-to-end solution with all the hardware/software interfaces and components necessary for augmenting emergent microgrids with CCC into full-fledged microgrids is presented. SEUP abstracts the details of sensing and CCC for the microgrid developers, installers, operators and end-users to provide a seamless system. SEUP is distinctive from other CCC platforms in that it is entirely based on publicly available infrastructure resources (wireless cellular networks, internet and cloud computing) without any intellectual property restrictions. The paper introduces the functional roles, main architecture, components and security features of SEUP along with the results from a sample application case of a laboratory-scale power system."; "Simple electric utility platform: A hardware/software solution for operating emergent microgrids"; 
"http://www.sciencedirect.com/science/article/pii/S1389128619307522"; "Computer Networks"; "2019"; "The Internet of Things (IoT), based on interconnected devices, enables a variety of elegant new services that could not be realized in a traditional environment, and many of these services harvest the information of a potentially sensitive and private nature belonging to individual users. Unfortunately, existing security functions used to protect such information are difficult to implement in an IoT environment due to the widely varying capacities, functionalities, and security requirements of IoT devices. In this work, to protect against unrestricted accesses to other devices and information extortion from these devices, we propose SODA, a secure IoT gateway that enables a device-side dynamic access control and is capable of deploying various security services to protect sensitive and private information. To show its effectiveness and practicality, we assume that a large number of IoT devices are crowded around an IoT gateway, and we implement a prototype of SODA for such an environment based on software-defined-networking (SDN) and integrate virtual network functions (VNFs) over network function virtualization (NFV) on top of a real IoT device. From our evaluation, we demonstrate how SODA mitigates real-world attacks through its security functions, and presents how it satisfies the performance requirements of a real environment."; "SODA: A software-defined security framework for IoT environments"; 
"http://www.sciencedirect.com/science/article/pii/S0167404818307569"; "Computers & Security"; "2018"; "As a mean to improve safety and convenience on the road, Vehicular Ad Hoc Networks (VANETs) provide various advantages to passengers. However, considering that it is a wireless ad hoc type network, it is usual to see numerous security exploits present in the environment. There are prevention methods as well as responsive solutions for network intrusions; the former is known as Intrusion Detection System (IDS), which monitors and detects potential intrusions that are ongoing in the network. Active network attacks are generally designed to reduce or interrupt availability of the network. Effect of these attackers on the network can be measured by select parameters, which can in turn be used as the main lead for detecting malicious behaviors. In this paper, we propose a complete IDS in VANET using the combination of modified promiscuous mode for data collection and Support Vector Machine (SVM) for data analysis to establish a shared trust value for every vehicle on the network as Trust Aware SVM-Based IDS (TSIDS). This method ensures that the source vehicle or node as well as any intermediate network node is aware of the activity of their next hop and in case of malicious behavior or malfunction, they will respond accordingly to keep the network performance as high as possible."; "Trust aware support vector machine intrusion detection and prevention system in vehicular ad hoc networks"; 
"http://www.sciencedirect.com/science/article/pii/S108480451500288X"; "Journal of Network and Computer Applications"; "2016"; "Cloud Computing offers virtualized computing, storage, and networking resources, over the Internet, to organizations and individual users in a completely dynamic way. These cloud resources are cheaper, easier to manage, and more elastic than sets of local, physical, ones. This encourages customers to outsource their applications and services to the cloud. The migration of both data and applications outside the administrative domain of customers into a shared environment imposes transversal, functional problems across distinct platforms and technologies. This article provides a contemporary discussion of the most relevant functional problems associated with the current evolution of Cloud Computing, mainly from the network perspective. The paper also gives a concise description of Cloud Computing concepts and technologies. It starts with a brief history about cloud computing, tracing its roots. Then, architectural models of cloud services are described, and the most relevant products for Cloud Computing are briefly discussed along with a comprehensive literature review. The paper highlights and analyzes the most pertinent and practical network issues of relevance to the provision of high-assurance cloud services through the Internet, including security. Finally, trends and future research directions are also presented."; "Review and analysis of networking challenges in cloud computing"; 
