"http://www.sciencedirect.com/science/article/pii/S1353485819300595"; "Network Security"; "2019"; "Increasingly complex multi-cloud architectures and more stringent regulatory environments have increased reliance on encryption – primarily secure sockets layer (SSL) and transport layer security (TLS) – to the extent that over 80% of all network traffic is now encrypted. While in many ways the growth of encryption is a good thing for security, it also creates a backdoor for hackers and threat actors looking to hide from traditional detection tools. Organisations are adopting more stringent encryption practices. And while the growth of encryption might seem a good thing for security, it also creates a backdoor for hackers and threat actors looking to hide from detection tools. Additionally, as organisations continue to move to the cloud, increase their utilisation of APIs and adopt ever-more complex and sensitive systems, they find themselves with ever-more complex multi-cloud architectures. The solution lies in encrypted cognitive analytics, argues Omar Yaacoubi of Barac, which enables the creation of new types of data elements or telemetry that are independent of protocol details."; "The rise of encrypted malware"; 
"http://www.sciencedirect.com/science/article/pii/S1084804519302504"; "Journal of Network and Computer Applications"; "2019"; "There is a lack of effective security solutions that autonomously, without any human intervention, detect and mitigate DDoS cyber-attacks. The lack is exacerbated when the network to be protected is a 5G mobile network. 5G networks push multi-tenancy to the edge of the network. Both the 5G user mobility and multi-tenancy are challenges to be addressed by current security solutions. These challenges lead to an insufficient protection of 5G users, tenants and infrastructures. This research proposes a novel autonomic security system, including the design, implementation and empirical validation to demonstrate the efficient protection of the network against Distributed Denial of Service (DDoS) attacks by applying countermeasures decided on and taken by an autonomic system, instead of a human. The self-management architecture provides support for all the different phases involved in a DDoS attack, from the detection of an attack to its final mitigation, through making the appropriate autonomous decisions and enforcing actions. Empirical experiments have been performed to protect a 5G multi-tenant infrastructure against a User Datagram Protocol (UDP) flooding attack, as an example of an attack to validate the design and prototype of the proposed architecture. Scalability results show self-protection against DDoS attacks, without human intervention, in around one second for an attack of 256 simultaneous attackers with 100 Mbps bandwidth per attacker. Furthermore, results demonstrate the proposed approach is flow-, user- and tenant-aware, which allows applying different protection strategies within the infrastructure."; "Autonomic protection of multi-tenant 5G mobile networks against UDP flooding DDoS attacks"; 
"http://www.sciencedirect.com/science/article/pii/S1084804517300541"; "Journal of Network and Computer Applications"; "2017"; "The Internet of Things (IoT) is enabling innovative applications in various domains. Due to its heterogeneous and wide-scale structure, it introduces many new security issues. To address this problem, we propose a framework for modeling and assessing the security of the IoT and provide a formal definition of the framework. Generally, the framework consists of five phases: (1) data processing, (2) security model generation, (3) security visualization, (4) security analysis, and (5) model updates. Using the framework, we can find potential attack scenarios in the IoT, analyze the security of the IoT through well-defined security metrics, and assess the effectiveness of different defense strategies. The framework is evaluated via three scenarios, which are the smart home, wearable healthcare monitoring and environment monitoring scenarios. We use the analysis results to show the capabilities of the proposed framework for finding potential attack paths and mitigating the impact of attacks."; "A framework for automating security analysis of the internet of things"; 
"http://www.sciencedirect.com/science/article/pii/S0167404818309568"; "Computers & Security"; "2019"; "Nowadays, online banking is an attractive way of carrying out financial operations such as ecommerce, e-banking, and e-payments without much effort or the need of any physical presence. This increasing popularity in online banking services and payment systems has created motivation for financial attackers to steal customer`s credentials and money. Banking trojans have been a way of committing attacks on these financial institutions for more than a decade, and they have become one of the primary drivers of botnet traffic. However, the stealthy nature of financial botnets requires new techniques and novel systems for detection and analysis in order to prevent losses and to ultimately take the botnets down. TrickBot, which specifically threatens businesses in the financial sector and their customers, has been behind man-in-the-browser attacks since 2016. Its main goal is to steal online banking information from victims when they visit their banking websites. In this study, we utilize machine learning techniques to detect TrickBot malware infections and to identify TrickBot related traffic flows without having to analyze network packet payloads, the IP addresses, port numbers and protocol information. Since command and control server IPs are updated almost daily, identification of TrickBot related traffic flows without looking at specific IP addresses is significant. We adopt behavior-based classification that uses artifacts created by the malware during the dynamic analysis of TrickBot malware samples. We compare the performance results of four different state-of-the-art machine learning algorithms, Random Forest, Sequential Minimal Optimization, Multilayer Perceptron, and Logistic Model to identify TrickBot related flows and detect a TrickBot infection. Then, we optimize the proposed classifier via exploring the best hyperparameter and feature set selection. Looking at network packet identifiers such as packet length, packet and flag counts, and inter-arrival times, the Random Forest classifier identifies TrickBot related flows with 99.9534% accuracy, 91.7% true positive rate."; "A flow-based approach for Trickbot banking trojan detection"; 
"http://www.sciencedirect.com/science/article/pii/S0167404818308952"; "Computers & Security"; "2019"; "Visualization helps to comprehend and analyze large amounts of data, a fundamental necessity for network security due to the large volume of audits traces produced each day. In this paper, we dissect the majority of recent work conducted in network security visualization and offer a taxonomy that provides a basis for classifying recently published works using nine criteria. Moreover, a comprehensive evaluation framework for comparing and ranking network security visualization systems and techniques is developed and presented. Finally, we present a taxonomy of network attacks, which covers most of the existing network attacks and provides a framework for the categorization of recent network security visualization systems."; "An evaluation framework for network security visualizations"; 
"http://www.sciencedirect.com/science/article/pii/S1874548215000463"; "International Journal of Critical Infrastructure Protection"; "2015"; "This paper surveys and provides experimental results related to network design techniques focused on enhancing the security of industrial control systems. It analyzes defense-in-depth strategies, network segmentation, network firewall configurations and the role of intrusion prevention systems, intrusion detection systems and anomaly detection systems. The paper also studies the applicability of emerging technologies in the area of IP networks, including software-defined networking, network functions virtualization and next generation firewalls in securing industrial control systems. The main contribution of this paper is the experimental assessment of existing and future network design approaches in the presence of real malware (e.g., Stuxnet) and synthetic attacks (e.g., denial-of-service attacks). The experimental results confirm the importance of defense-in-depth strategies and also highlight the embryonic state of software-defined networking security, which requires profound transformation and validation in order to be embraced by the industrial control system community."; "Experimental assessment of network design approaches for protecting industrial control systems"; 
"http://www.sciencedirect.com/science/article/pii/S0164121217300158"; "Journal of Systems and Software"; "2017"; "Advancements in sensing and communication technologies are enabling intelligent transportation systems (ITS) to easily acquire large volumes of road traffic big data. Querying road traffic data is a crucial task for providing citizens with more insightful information on traffic conditions. In this paper, we have developed a similarity query system for road traffic big data, called SigTrac, that runs on top of an existing MongoDB document store. The SigTrac system represents road traffic sensor data having spatio-temporal characteristics into traffic matrices and stores them into a MongoDB NoSQL document store by exploiting map-reduce operations of MongoDB. In addition, SigTrac efficiently processes similarity queries for traffic data with singular value decomposition (SVD)-based and incremental SVD-based algorithms. Our experimental studies with real traffic data demonstrate the efficiency of SiqTrac for similarity query processing for road traffic big data."; "A similarity query system for road traffic data based on a NoSQL document store"; 
"http://www.sciencedirect.com/science/article/pii/S0167404817302638"; "Computers & Security"; "2018"; "In an always connected world, cyber-attacks and computer security breaches can produce significant financial damages as well as introduce new risks and menaces in everyday's life. As a consequence, more and more sophisticated packet screening/filtering solutions are deployed everywhere, typically on network border devices, in order to sanitize Internet traffic. Despite the obvious benefits associated to the proactive detection of security threats, these devices, by performing deep packet inspection and inline analysis, may both affect latency-sensitive traffic introducing non-negligible delays, and increase the energy demand at the network element level. Starting from these considerations, we present a selective routing and intrusion detection technique based on dynamic statistical analysis. Our technique separates latency-sensitive traffic from latency-insensitive one and adaptively organizes the intrusion detection activities over multiple nodes. This allows suppressing directly at the network ingress, when possible, all the undesired components of latency-insensitive traffic and distributing on the innermost nodes the security check for latency sensitive flows, prioritizing routing activities over security scanning ones. Our final goal is demonstrating that selective intrusion detection can result in significant energy savings without adversely affecting latency-sensitive traffic by introducing unacceptable processing delays."; "Saving energy in aggressive intrusion detection through dynamic latency sensitivity recognition"; 
"http://www.sciencedirect.com/science/article/pii/S1071581919300564"; "International Journal of Human-Computer Studies"; "2019"; "Five decades ago advances in integrated circuits and time-sharing operating systems made interactive use of computers economically feasible. Visions of man-computer symbiosis and the augmentation of man’s intellect became realistic research objectives. The initial focus was on facilitating interactivity through improved interface technology, and supporting its application through good practices based on experience and psychological principles. Within a decade technology advances made low cost personal computers commonly available in the home, office and industry, and these were rapidly enhanced with software that made them attractive in a wide range of applications from games to office automation and industrial process control. Within three decades the Internet enabled human–computer interaction to extend across local, national and international networks, and, within four, smartphones and tablets had made access to computers and networks almost ubiquitous to any person, at any time and any place. Banking, commerce, institutional and company operations, utility and government infrastructures, took advantage of, and became dependent on, interactive computer and networking capabilities to such an extent that they have now been assimilated in our society and are taken for granted. This hyperconnectivity has been a major economic driver in the current millennium, but it has also raised new problems as malevolent users anywhere in the world have become able to access and interfere with critical personal, commercial and national resources. A major issue for human–computer studies now is to maintain and enhance functionality, usability and likeability for legitimate users whilst protecting them from malevolent users. Understanding the issues involved requires a far broader consideration of socio-economic issues than was required five decades ago. This article reviews various models of the role of technology in human civilization that can provide insights into our current problématique."; "From facilitating interactivity to managing hyperconnectivity: 50 years of human–computer studies"; 
"http://www.sciencedirect.com/science/article/pii/S0167404817301827"; "Computers & Security"; "2018"; "Device security is one of the major challenges for successful implementation of Internet of Things and fog computing environment in current IT space. Researchers and Information Technology (IT) organizations have explored many solutions to protect systems from unauthenticated device attacks (known as outside device attacks). Fog computing uses network devices (e.g. router, switch and hub) for latency-aware processing of collected data using IoT. Then, identification of malicious edge device is one of the critical activities in data security of fog computing environment. Preventing attacks from malicious edge devices in fog computing environment is more difficult because they have certain granted privileges to use and process the data. In this paper, proposed cybersecurity framework uses three technologies which are Markov model, Intrusion Detection System (IDS) and Virtual Honeypot Device (VHD) to identify malicious edge device in fog computing environment. A two-stage hidden Markov model is used to effectively categorize edge devices in four different levels. VHD is designed to store and maintain log repository of all identified malicious devices which assists the system to defend itself from any unknown attacks in the future. Proposed cybersecurity framework is tested with real attacks in virtual environment created using OpenStack and Microsoft Azure. Results indicated that proposed cybersecurity framework is successful in identifying the malicious device as well as reducing the false IDS alarm rate."; "A cybersecurity framework to identify malicious edge device in fog computing and cloud-of-things environments"; 
"http://www.sciencedirect.com/science/article/pii/S0007681317300046"; "Business Horizons"; "2017"; "Big data represents a new technology paradigm for data that are generated at high velocity and high volume, and with high variety. Big data is envisioned as a game changer capable of revolutionizing the way businesses operate in many industries. This article introduces an integrated view of big data, traces the evolution of big data over the past 20 years, and discusses data analytics essential for processing various structured and unstructured data. This article illustrates the application of data analytics using merchant review data. The impacts of big data on key business performances are then evaluated. Finally, six technical and managerial challenges are discussed."; "Big data: Dimensions, evolution, impacts, and challenges"; 
"http://www.sciencedirect.com/science/article/pii/S0167404819301099"; "Computers & Security"; "2019"; "The connectivity of embedded systems is increasing accompanied with thriving technology such as Internet of Things/Everything (IoT/E), Connected Cars, Smart Cities, Industry 4.0, 5G or Software-Defined Everything. Apart from the benefits of these trends, the continuous networking offers hackers a broad spectrum of attack vectors. The identification of attacks or unknown behavior through Intrusion Detection Systems (IDS) has established itself as a conducive and mandatory mechanism apart from the protection by cryptographic schemes in a holistic security eco-system. In systems where resources are valuable goods and stand in contrast to the ever increasing amount of network traffic, sampling has become a useful utility in order to detect malicious activities on a manageable amount of data. In this work an algorithm – Uncoupled MAC – is presented which secures network communication through a cryptographic scheme by uncoupled Message Authentication Codes (MAC) but as a side effect also provides IDS functionality producing alarms based on the violation of Uncoupled MAC values. Through a novel self-regulation extension, the algorithm adapts it’s sampling parameters based on the detection of malicious actions. The evaluation in a virtualized environment clearly shows that the detection rate increases over runtime for different attack scenarios. Those even cover scenarios in which intelligent attackers try to exploit the downsides of sampling."; "A resource-preserving self-regulating Uncoupled MAC algorithm to be applied in incident detection"; 
"http://www.sciencedirect.com/science/article/pii/S0167404818301913"; "Computers & Security"; "2018"; "Software Defined Network (SDN) paradigm provides intelligent and efficient management of different network control functions (NF) depending on changes in traffic behavior, service providers’ requirements and application context. However, the logical centralization of controllers’ functions opens up challenges towards enforcing security perimeter over the underlying network and the assets involved. In this paper, we propose a risk assessment model for pro-active secure flow control and routing of traffic in SDN. The proposed model determines threat value of different SDN entities by analyzing vulnerability and exposure with respect to Common Vulnerability Scoring System (CVSS). The risk of a given traffic is calculated as cumulative threat values of the SDN entities that guides the flow and routing control functions in generating secure flow rules for the forwarding switches. The efficacy of the proposed model is demonstrated through extensive case studies of an enterprise network."; "Risk based Security Enforcement in Software Defined Network"; 
"http://www.sciencedirect.com/science/article/pii/S0167739X17328406"; "Future Generation Computer Systems"; "2019"; "In multiple Service Nodes (SNs) in a Network Function Virtualization (NFV) environment, numerous network functions are carried out. This study concerns the selection of Service Function Instances (SFIs) that are integrated into a Service Function Path (SFP) in resource-constrained networks with various functional requirements. Imbalanced loads in the network system are prevented and a service chain with a high Service Level Agreement (SLA) is developed. An NFV-based Service Function Chain (SFC) integration architecture is designed and an SFP selection mechanism is developed to provide a flexible service chain that satisfies service requests. Two cases are discussed to analyze the effectiveness of the mechanism. The proposed SFP selection mechanism improves the resource utilization of SFIs, prevents the overloading of SFIs, increases the number of service chains that can be serviced by the system, and reduces the packet loss rate. The proposed selection mechanism is compared with without selection mechanism to verify its performance. In case 1, only the load of the SFIs is considered. An SFC controller with the proposed SFP selection mechanism improves resource utilization by 21.32% and reduces the standard deviation of instantaneous loads by 30.02%. In case 2, the acceptable price of instances of service function is considered. The case 2 improves resource utilization by 10.31%, and the standard deviation of the instantaneous load is reduced by 18.73%. An analysis of the rejection rate indicates that the proposed mechanism improves the number of service chains that can be serviced by the system and reduces the mean packet loss rate by 1.91%."; "Adaptive service function selection for Network Function Virtualization networking"; 
"http://www.sciencedirect.com/science/article/pii/S0167404818301524"; "Computers & Security"; "2019"; "Open-source intelligence (OSINT) is intelligence collected from publicly available sources to meet specific intelligence requirements. This paper proposes a new method to localise and profile the movement of social network users through OSINT and machine learning techniques. Analysis of obtained OSINT social networks posts data from targeted users, suggests that it is possible to extract information such as their approximate location, leading also to the profiling of their movement, without using any supported Global Navigation Satellite System functionality which may be passed to the social network through a capable smart device. The ability to profile a target's movement activity could allow anyone to track a social network user or predict his or her future location. Moreover, in this work, we also demonstrate that information from social networks can be extracted relatively in real time, thus targeted users are prone to lose any sense of physical privacy."; "Localising social network users and profiling their movement"; 
"http://www.sciencedirect.com/science/article/pii/S1084804515002994"; "Journal of Network and Computer Applications"; "2016"; "In the last few decades, various network attacks have emerged. This phenomenon requires serious consideration to address its extensive consequences. To overcome the effects of network attacks, an appropriate intrusion detection system and a real-time intrusion response system are required. In this paper, we present an IRS taxonomy based on design parameters to classify existing schemes. Furthermore, we investigate the essential response design parameters for IRS to mitigate attacks in real time and obtain a robust output. The majority of existing schemes disregard the importance of semantic coherence and dynamic response parameters in the response selection process. Therefore, most existing schemes produce inaccurate results by generating false alarms. These design parameters are comprehensively discussed in this paper. We have qualitatively analyzed existing IRS schemes on the basis of the response design parameters. Open research challenges are identified to highlight key research areas in this research domain."; "Intrusion response systems: Foundations, design, and challenges"; 
"http://www.sciencedirect.com/science/article/pii/S108480451930027X"; "Journal of Network and Computer Applications"; "2019"; "Software Defined Networking (SDN) has emerged as a new networking paradigm for managing different kinds of networks ranging from enterprise to home network through software enabled control. The logically centralized control plane and programmability offers a great opportunity to improve network security, like implementing new mechanisms to detect and mitigate various threats, as well as enables deploying security as a service on the SDN controller. Due to the increasing and fast development of SDN, this paper provides an extensive survey on the application of SDN on enhancing the security of computer networks. In particular, we survey recent research studies that focus on applying SDN for network security including attack detection and mitigation, traffic monitoring and engineering, configuration and policy management, service chaining, and middlebox deployment, in addition to smart grid security. We further identify some challenges and promising future directions on SDN security, compatibility and scalability issues that should be addressed in this field."; "The application of Software Defined Networking on securing computer networks: A survey"; 
